{
  "$schema": "./dyknow.config.schema.json",
  "projectName": "DyKnow",
  "mode": "local-only",
  "allowedSources": [
    "README.md",
    "AGENTS.md",
    "CLAUDE.md",
    "CHANGELOG.md",
    "CONTRIBUTING.md",
    ".github/**",
    "docs/**",
    "packages/**",
    "package.json",
    "tsconfig*.json",
    "biome.json"
  ],
  "ignoredSources": [
    ".env",
    ".env.*",
    "secrets/**",
    "node_modules/**",
    "dist/**",
    "coverage/**",
    "logs/**"
  ],
  "pages": [
    {
      "id": "product-overview",
      "title": "Product Overview",
      "outputPath": "docs/product-overview.md",
      "audience": "mixed",
      "sources": ["README.md", "docs/**", "packages/**"],
      "reviewRules": {
        "approvalRequired": true
      }
    },
    {
      "id": "feature-map",
      "title": "Feature Map",
      "outputPath": "docs/feature-map.md",
      "audience": "mixed",
      "sources": ["README.md", "docs/**", "packages/**", ".github/**"],
      "reviewRules": {
        "approvalRequired": true
      }
    },
    {
      "id": "architecture",
      "title": "Architecture",
      "outputPath": "docs/architecture.md",
      "audience": "mixed",
      "sources": ["README.md", "docs/**", "packages/**", "package.json"],
      "reviewRules": {
        "approvalRequired": true
      }
    },
    {
      "id": "setup-guide",
      "title": "Setup Guide",
      "outputPath": "docs/setup-guide.md",
      "audience": "external",
      "sources": ["README.md", "docs/**", "package.json", "packages/**"],
      "reviewRules": {
        "approvalRequired": true
      }
    },
    {
      "id": "agent-context",
      "title": "AI Agent Context",
      "outputPath": "AGENTS.md",
      "audience": "agent",
      "sources": [
        "README.md",
        "AGENTS.md",
        "CLAUDE.md",
        ".github/**",
        "docs/**",
        "packages/**"
      ],
      "reviewRules": {
        "approvalRequired": true
      }
    }
  ],
  "approvalRequired": true,
  "llmProvider": "local",
  "publishTargets": []
}
